{
  "$schema": "https://json-schema.org/draft/2020-12/schema",
  "$id": "https://telemetryiq.local/schemas/config/0.1.0",
  "title": "TelemetryIQ local-only configuration",
  "type": "object",
  "additionalProperties": false,
  "required": ["schema_version", "mode", "collection", "storage", "sharing"],
  "properties": {
    "schema_version": {"const": "0.1.0"},
    "mode": {"const": "local-only"},
    "collection": {
      "type": "object",
      "additionalProperties": false,
      "required": ["level", "prompts", "responses", "source_code", "tool_calls", "model_usage"],
      "properties": {
        "level": {"enum": ["aggregate", "operational"]},
        "prompts": {"const": false},
        "responses": {"const": false},
        "source_code": {"const": false},
        "tool_calls": {"type": "boolean"},
        "model_usage": {"type": "boolean"}
      }
    },
    "storage": {
      "type": "object",
      "additionalProperties": false,
      "required": ["destination", "retention_days"],
      "properties": {
        "destination": {"const": "local"},
        "retention_days": {"type": "integer", "minimum": 1}
      }
    },
    "sharing": {
      "type": "object",
      "additionalProperties": false,
      "required": ["diagnostics", "anonymous_analytics", "research_sessions"],
      "properties": {
        "diagnostics": {"const": false},
        "anonymous_analytics": {"const": false},
        "research_sessions": {"const": "explicit-only"}
      }
    },
    "pricing": {
      "type": "object",
      "additionalProperties": false,
      "properties": {"override_path": {"type": "string"}}
    },
    "insights": {
      "type": "object",
      "additionalProperties": false,
      "properties": {
        "context_waste": {
          "type": "object",
          "additionalProperties": false,
          "properties": {
            "cached_context_ratio_threshold": {"type": "number", "minimum": 0, "maximum": 1},
            "input_token_growth_threshold": {"type": "number", "minimum": 1}
          }
        }
      }
    },
    "governance": {
      "type": "object",
      "additionalProperties": false,
      "properties": {
        "mcp_allowlist": {
          "type": "array",
          "items": {"type": "string", "minLength": 1, "pattern": "\\S"}
        },
        "skills_allowlist": {
          "type": "array",
          "maxItems": 100,
          "items": {"type": "string", "minLength": 1, "maxLength": 1024, "pattern": "\\S"}
        },
        "path_rules": {
          "type": "object",
          "additionalProperties": false,
          "required": ["mode", "allowed", "blocked"],
          "properties": {
            "mode": {"enum": ["monitor", "approved_only", "flag_all"]},
            "allowed": {"$ref": "#/$defs/pathPatterns"},
            "blocked": {"$ref": "#/$defs/pathPatterns"}
          }
        },
        "prompt_keywords": {
          "type": "array",
          "maxItems": 100,
          "items": {"$ref": "#/$defs/promptKeyword"}
        }
      }
    }
  },
  "$defs": {
    "pathPatterns": {
      "type": "array",
      "maxItems": 100,
      "items": {
        "type": "object",
        "additionalProperties": false,
        "required": ["kind", "value"],
        "properties": {
          "kind": {"enum": ["exact", "glob"]},
          "value": {"type": "string", "minLength": 1, "maxLength": 1024, "pattern": "\\S"}
        }
      }
    },
    "promptKeyword": {
      "type": "object",
      "additionalProperties": false,
      "required": ["id", "label", "group", "enabled", "kind", "value"],
      "properties": {
        "id": {"type": "string", "minLength": 1, "maxLength": 64, "pattern": "^[A-Za-z0-9_-]+$"},
        "label": {"type": "string", "minLength": 1, "maxLength": 120},
        "group": {"enum": ["credentials", "customer_data", "custom"]},
        "enabled": {"type": "boolean"},
        "kind": {"enum": ["literal", "regex"]},
        "value": {"type": "string", "minLength": 1, "maxLength": 1024}
      }
    }
  }
}
