{"schema_version":"0.1.0","mode":"local-only","collection":{"level":"operational","prompts":false,"responses":false,"source_code":false,"tool_calls":true,"model_usage":true},"storage":{"destination":"local","retention_days":30},"sharing":{"diagnostics":false,"anonymous_analytics":false,"research_sessions":"explicit-only"},"governance":{"prompt_keywords":[{"id":"aws-key","label":"AWS access key","group":"credentials","enabled":false,"kind":"regex","value":"AKIA[0-9A-Z]{16}"}]}}
